{
  "schema_version": 1,
  "fixture_version": "rag-v1",
  "name": "KRX Rule MCP versioned RAG evaluation golden set",
  "source": {
    "url": "https://gist.githubusercontent.com/chromato99/83b3d788faaacba879210438c46044bc/raw/8cd3ddd0bd363e6315cd725cad4da08f4eaed292/krx-rule-mcp-rag-evaluation-queries-2026-07-28.json",
    "sha256": "b74857ad390a79b05b4e4ee2df9a04f46db6153b27b64f654be6737bbc199067",
    "evaluation_date": "2026-07-28",
    "original_cases": 50
  },
  "policies": {
    "chunk_ids_in_expectations": false,
    "scores_are_confidence": false,
    "manual_review_excluded_from_automatic_evidence_metrics": true
  },
  "cases": [
    {
      "id": "exact-listing-consult",
      "group": "exact",
      "split": "regression",
      "input": {
        "query": "상장예비심사 신청 전 사전협의 의무",
        "language": "ko",
        "document_type": "rule",
        "limit": 5
      },
      "expectation": {
        "evidence_status": "supported",
        "claim_relation": "supports",
        "target_policy": "any",
        "targets": [
          {
            "document_id": "210220143",
            "article_id": "제20조"
          }
        ]
      }
    },
    {
      "id": "exact-realtime-limit",
      "group": "exact",
      "split": "regression",
      "input": {
        "query": "실시간 가격제한의 가격변동폭 별표 25",
        "language": "ko",
        "document_type": "rule",
        "limit": 5
      },
      "expectation": {
        "evidence_status": "supported",
        "claim_relation": "supports",
        "target_policy": "any",
        "targets": [
          {
            "document_id": "210228709",
            "article_id": "제60조의4"
          },
          {
            "document_id": "210228709",
            "attachment_id": "210228709-210217359-hwp"
          }
        ]
      }
    },
    {
      "id": "exact-margin-use",
      "group": "exact",
      "split": "regression",
      "input": {
        "query": "위탁증거금의 사용제한 대용증권 외화",
        "language": "ko",
        "document_type": "rule",
        "limit": 5
      },
      "expectation": {
        "evidence_status": "supported",
        "claim_relation": "supports",
        "target_policy": "any",
        "targets": [
          {
            "document_id": "210199976",
            "article_id": "제139조"
          }
        ]
      }
    },
    {
      "id": "exact-settlement-recalc",
      "group": "exact",
      "split": "regression",
      "input": {
        "query": "최종결제가격 재산출 손해배상청구권 배제",
        "language": "ko",
        "document_type": "rule",
        "limit": 5
      },
      "expectation": {
        "evidence_status": "supported",
        "claim_relation": "supports",
        "target_policy": "any",
        "targets": [
          {
            "document_id": "210199976",
            "article_id": "제165조"
          }
        ]
      }
    },
    {
      "id": "exact-intraday-margin",
      "group": "exact",
      "split": "regression",
      "input": {
        "query": "일중청산위탁증거금 예탁시한",
        "language": "ko",
        "document_type": "rule",
        "limit": 5
      },
      "expectation": {
        "evidence_status": "supported",
        "claim_relation": "supports",
        "target_policy": "any",
        "targets": [
          {
            "document_id": "210124485",
            "article_id": "제88조"
          }
        ]
      }
    },
    {
      "id": "exact-lei",
      "group": "exact",
      "split": "regression",
      "input": {
        "query": "거래당사자 식별정보 LEI 사용의무",
        "language": "ko",
        "document_type": "rule",
        "limit": 5
      },
      "expectation": {
        "evidence_status": "supported",
        "claim_relation": "supports",
        "target_policy": "any",
        "targets": [
          {
            "document_id": "204847960",
            "article_id": "제17조"
          }
        ]
      }
    },
    {
      "id": "exact-uti",
      "group": "exact",
      "split": "regression",
      "input": {
        "query": "보고대상거래 건별 UTI 포함",
        "language": "ko",
        "document_type": "rule",
        "limit": 5
      },
      "expectation": {
        "evidence_status": "supported",
        "claim_relation": "supports",
        "target_policy": "any",
        "targets": [
          {
            "document_id": "204847960",
            "article_id": "제18조"
          }
        ]
      }
    },
    {
      "id": "exact-fair-disclosure",
      "group": "exact",
      "split": "regression",
      "input": {
        "query": "공정공시 대상정보 우회제공 금지",
        "language": "ko",
        "document_type": "rule",
        "limit": 5
      },
      "expectation": {
        "evidence_status": "supported",
        "claim_relation": "supports",
        "target_policy": "any",
        "targets": [
          {
            "document_id": "204844930",
            "article_id": "제5조"
          },
          {
            "document_id": "204844585",
            "article_id": "제5조"
          }
        ]
      }
    },
    {
      "id": "semantic-listing-consult",
      "group": "semantic",
      "split": "regression",
      "input": {
        "query": "상장 신청 전에 거래소랑 절차와 시기를 먼저 상의해야 하나",
        "language": "ko",
        "document_type": "rule",
        "limit": 5
      },
      "expectation": {
        "evidence_status": "supported",
        "claim_relation": "supports",
        "target_policy": "any",
        "targets": [
          {
            "document_id": "210220143",
            "article_id": "제20조"
          }
        ]
      }
    },
    {
      "id": "semantic-nav",
      "group": "semantic",
      "split": "regression",
      "input": {
        "query": "ETF 종가가 NAV에서 너무 벌어지면 LP는 어떤 호가를 내야 하나",
        "language": "ko",
        "document_type": "rule",
        "limit": 5
      },
      "expectation": {
        "evidence_status": "supported",
        "claim_relation": "supports",
        "target_policy": "any",
        "targets": [
          {
            "document_id": "210225665",
            "article_id": "제20조의4"
          }
        ]
      }
    },
    {
      "id": "semantic-margin-use",
      "group": "semantic",
      "split": "regression",
      "input": {
        "query": "고객이 맡긴 증거금을 회원사 돈처럼 다른 데 써도 되나",
        "language": "ko",
        "document_type": "rule",
        "limit": 5
      },
      "expectation": {
        "evidence_status": "supported",
        "claim_relation": "supports",
        "target_policy": "any",
        "targets": [
          {
            "document_id": "210199976",
            "article_id": "제139조"
          }
        ]
      }
    },
    {
      "id": "semantic-settlement",
      "group": "semantic",
      "split": "regression",
      "input": {
        "query": "결제 전에 선물 최종가격이 잘못된 걸 발견하면 거래소가 다시 계산할 수 있나",
        "language": "ko",
        "document_type": "rule",
        "limit": 5
      },
      "expectation": {
        "evidence_status": "supported",
        "claim_relation": "supports",
        "target_policy": "any",
        "targets": [
          {
            "document_id": "210199976",
            "article_id": "제165조"
          }
        ]
      }
    },
    {
      "id": "semantic-intraday",
      "group": "semantic",
      "split": "regression",
      "input": {
        "query": "청산회원이 장중에 추가 증거금 내라는 통보를 받으면 언제까지 받아야 하나",
        "language": "ko",
        "document_type": "rule",
        "limit": 5
      },
      "expectation": {
        "evidence_status": "supported",
        "claim_relation": "supports",
        "target_policy": "any",
        "targets": [
          {
            "document_id": "210124485",
            "article_id": "제88조"
          }
        ]
      }
    },
    {
      "id": "semantic-typo",
      "group": "semantic",
      "split": "regression",
      "input": {
        "query": "상장예비심사 사전 햡의",
        "language": "ko",
        "document_type": "rule",
        "limit": 5
      },
      "expectation": {
        "evidence_status": "supported",
        "claim_relation": "supports",
        "target_policy": "any",
        "targets": [
          {
            "document_id": "210220143",
            "article_id": "제20조"
          }
        ]
      }
    },
    {
      "id": "semantic-mixed-limit",
      "group": "semantic",
      "split": "regression",
      "input": {
        "query": "KRX futures real-time 상하한가 폭",
        "language": "ko",
        "document_type": "rule",
        "limit": 5
      },
      "expectation": {
        "evidence_status": "supported",
        "claim_relation": "supports",
        "target_policy": "any",
        "targets": [
          {
            "document_id": "210228709",
            "article_id": "제60조의4"
          },
          {
            "document_id": "210199976",
            "article_id": "제70조의2"
          }
        ]
      }
    },
    {
      "id": "semantic-lei",
      "group": "semantic",
      "split": "regression",
      "input": {
        "query": "거래 상대방을 보고할 때 법인 식별번호 뭐 써야 해",
        "language": "ko",
        "document_type": "rule",
        "limit": 5
      },
      "expectation": {
        "evidence_status": "supported",
        "claim_relation": "supports",
        "target_policy": "any",
        "targets": [
          {
            "document_id": "204847960",
            "article_id": "제17조"
          }
        ]
      }
    },
    {
      "id": "alias-dynamic-limit",
      "group": "alias",
      "split": "regression",
      "input": {
        "query": "동적상하한가",
        "language": "ko",
        "document_type": "rule",
        "limit": 5
      },
      "expectation": {
        "evidence_status": "supported",
        "claim_relation": "supports",
        "target_policy": "any",
        "targets": [
          {
            "document_id": "210228709",
            "article_id": "제60조의4"
          },
          {
            "document_id": "210199976",
            "article_id": "제70조의2"
          }
        ],
        "query_expansion": {
          "required_entry_ids": [
            "derivatives_realtime_price_limit"
          ],